{
  "$schema": "http://json-schema.org/draft-07/schema#",
  "title": "Source Config",
  "description": "Configuration for token source files. Designers can add new paths without editing build.js.",
  "type": "object",
  "required": ["basePath", "light", "dark"],
  "properties": {
    "basePath": {
      "type": "string",
      "description": "Base path for token files (relative to project root)"
    },
    "light": {
      "type": "array",
      "items": { "type": "string" },
      "description": "Source files for light theme build (paths relative to basePath)"
    },
    "dark": {
      "type": "array",
      "items": { "type": "string" },
      "description": "Source files for dark theme build (paths relative to basePath)"
    },
    "designerImportsFolder": {
      "type": "string",
      "description": "Folder name under basePath. Any *.json files here are auto-included in both light and dark builds."
    }
  }
}
