{
  "$schema": "./source-config.schema.json",
  "basePath": "Nexus-Source-Tokens/tokens",
  "light": [
    "01 Primitive ✅/Mode 1.json",
    "01 rem ✅/Mode 1.json",
    "02 Alias ✅/myQ.json",
    "03 Palette ✅/light.json",
    "03 Responsive ✅/Larger Breakpoint.json",
    "03 Mapped ✅/Mode 1.json"
  ],
  "dark": [
    "01 Primitive ✅/Mode 1.json",
    "01 rem ✅/Mode 1.json",
    "02 Alias ✅/myQ.json",
    "03 Palette ✅/dark.json",
    "03 Responsive ✅/Larger Breakpoint.json",
    "03 Mapped ✅/Mode 1.json"
  ],
  "designerImportsFolder": "04 Designer Imports"
}
